<?xml version="1.0" ?>
<TcMenuPluginDefinition shortName="core-remote" xmlns="https://www.thecoderscorner.com/libraries/tcmenuPlugin"
                        xmlns:xsi="http://www.w3.org/2001/XMLSchema-instance"
                        xsi:schemaLocation="https://www.thecoderscorner.com/libraries/tcmenuPlugin https://tcmenu.github.io/documentation/arduino-libraries/libraries/tcmenu-plugin.xsd">
    <GeneralDetails>
        <Author name="The Coders Corner" url="http://www.thecoderscorner.com/" />
        <Version>9.99.99</Version>
        <Name>Core remote control</Name>
        <Description>This plugin contains remote control capabilites for Ethernet, WiFi, Bluetooth and Serial.</Description>
        <License name="Apache 2.0" url="http://www.apache.org/licenses/LICENSE-2.0"/>
    </GeneralDetails>

    <Plugins>
        <Plugin>noRemote.xml</Plugin>

        <!-- arduino remote plugins -->
        <Plugin>remoteSerial.xml</Plugin>
        <Plugin>remoteEthernet.xml</Plugin>

        <!-- esp specific -->
        <Plugin>remoteSerialESP.xml</Plugin>
        <Plugin>remoteWifiESP.xml</Plugin>

        <!-- client device -->
        <Plugin>clientRemoteEthernet.xml</Plugin>

        <!-- true cpp specific -->
        <Plugin>remoteMbedEthernet.xml</Plugin>
        <Plugin>remoteStdio.xml</Plugin>

        <!-- simhub connector -->
        <Plugin>simhubConnector.xml</Plugin>
    </Plugins>
</TcMenuPluginDefinition>
