<?xml version="1.0" ?>
<TcMenuPluginDefinition shortName="demo-plugin" xmlns="https://www.thecoderscorner.com/libraries/tcmenuPlugin"
                        xmlns:xsi="http://www.w3.org/2001/XMLSchema-instance"
                        xsi:schemaLocation="https://www.thecoderscorner.com/libraries/tcmenuPlugin https://www.thecoderscorner.com/libraries/tcmenu-plugin.xsd">
    <GeneralDetails>
        <Author name="The Coders Corner" url="http://www.thecoderscorner.com/" />
        <Version>1.3.5</Version>
        <Name>Demo plugin</Name>
        <Description>This plugin shows how to write plugins.</Description>
        <License name="Apache 2.0" url="http://www.apache.org/licenses/LICENSE-2.0"/>
    </GeneralDetails>

    <Plugins>
        <!-- each plugin item is listed below -->
        <Plugin>example-plugin-item.xml</Plugin>
    </Plugins>
</TcMenuPluginDefinition>