<?xml version="1.0" ?>
<TcMenuPluginDefinition shortName="core-themes" xmlns="https://www.thecoderscorner.com/libraries/tcmenuPlugin"
                        xmlns:xsi="http://www.w3.org/2001/XMLSchema-instance"
                        xsi:schemaLocation="https://www.thecoderscorner.com/libraries/tcmenuPlugin https://tcmenu.github.io/documentation/arduino-libraries/libraries/tcmenu-plugin.xsd">
    <GeneralDetails>
        <Author name="The Coders Corner" url="http://www.thecoderscorner.com/" />
        <Version>9.99.99</Version>
        <Name>%plugin.name</Name>
        <Description>This plugin provides themes that can be used with all graphical displays.</Description>
        <License name="Apache 2.0" url="http://www.apache.org/licenses/LICENSE-2.0"/>
    </GeneralDetails>

    <Plugins>
        <!-- mono plugins based on builder -->
        <Plugin>MonoInverseTitleBuilder.xml</Plugin>
        <Plugin>MonoBorderedTitleBuilder.xml</Plugin>

        <!-- Blue hue plugins -->
        <Plugin>CoolBlueModernBuilder.xml</Plugin>
        <Plugin>CoolBlueTraditionalBuilder.xml</Plugin>

        <!-- dark mode plugin -->
        <Plugin>DarkModeModernBuilder.xml</Plugin>
        <Plugin>DarkModeTraditionalBuilder.xml</Plugin>

        <!-- Manual plugins -->
        <Plugin>ManualTheme.xml</Plugin>
        <Plugin>NoThemeSelected.xml</Plugin>

        <!-- legacy plugins to delete in 12 months -->
        <Plugin>MonoBorderedTitle.xml</Plugin>
        <Plugin>MonoInverseTitle.xml</Plugin>
        <Plugin>CoolBlueModern.xml</Plugin>
        <Plugin>DarkModeModern.xml</Plugin>
        <Plugin>CoolBlueTraditional.xml</Plugin>
        <Plugin>DarkModeTraditional.xml</Plugin>
    </Plugins>
</TcMenuPluginDefinition>
